http://twitter.com/TheInklingGirl/status/1297947057290969090,24/08/20 11:21:48,24/08/20 11:21:07,24/08/20 11:21:52,,You know what? Worth a shot. Especially since there’s a hurricane headed for me and I’m not sure I’ll still have a house on Friday. 😭🤞🏻 pic.twitter.com/GEbnepZkA9,,You know what? Worth a shot. Especially since there’s a hurricane headed for me and I’m not sure I’ll still have a house on Friday. 😭🤞🏻 https://t.co/GEbnepZkA9,http://twitter.com/TheInklingGirl/,http://twitter.com/,http://twitter.com/,http://twitter.com/TheInklingGirl/status/1297947057290969090,en,0,65,0,0,"SOCIALMEDIA,SOCIALMEDIA_TWITTER",IMAGE,,,"containsImage,hasImage,isNewsHost,isQuestion",,,"[{""display_url"":""pic.twitter.com/GEbnepZkA9"",""expanded_url"":""https://twitter.com/TheInklingGirl/status/1297947057290969090/photo/1"",""url"":""https://t.co/GEbnepZkA9""},{""display_url"":""twitter.com/pulte/status/1…"",""expanded_url"":""https://twitter.com/pulte/status/1297912985051176960"",""url"":""https://t.co/zDj9fJDXTN""}]",http://pbs.twimg.com/media/EgM7tNtXgAEUOCx.jpg,0,0,,,0,0,,,SEARCH /  / hurricane,0,0,0,0,0,0,0,0,0,0,0,0,0,2091000000,0,484,0,0,North America,United States,us,Louisiana,"Baton Rouge, Louisiana",-91.1370849609375,30.45684814453125,tw:37600941,,Morgan Allain,0,DAY,FEMALE,http://pbs.twimg.com/profile_images/1264791732664832000/1znxDRRE_normal.jpg,TheInklingGirl,http://twitter.com/TheInklingGirl/,North America,United States,us,Louisiana,"Baton Rouge, Louisiana",-91.1370849609375,30.45684814453125,North America,United States,us,Louisiana,"Baton Rouge, Louisiana",-91.1370849609375,30.45684814453125,1,484,,MOBILE_OTHER,214681744,1,"Artist weirdo. Slytherin. I love red lipstick, hedgehogs, Buffy the Vampire Slayer, and true crime podcasts. My favorite word is recalcitrant.",0,Morgan Allain,26,
http://twitter.com/NWSNewOrleans/status/1298015026888888321,24/08/20 15:57:11,24/08/20 15:51:13,24/08/20 15:57:20,,📡 Can you spot the little swirl on visible satellite? That is Tropical Storm #Marco! Expect landfall here shortly somewhere along the MS Delta with isolated showers 🌧️continuing across the area. #lawx #mswx pic.twitter.com/ECBlR6mSnh,,📡 Can you spot the little swirl on visible satellite? That is Tropical Storm #Marco! Expect landfall here shortly somewhere along the MS Delta with isolated showers 🌧️continuing across the area. #lawx #mswx https://t.co/ECBlR6mSnh,http://twitter.com/NWSNewOrleans/,http://twitter.com/,http://twitter.com/,http://twitter.com/NWSNewOrleans/status/1298015026888888321,en,0,68,0,0,"SOCIALMEDIA,SOCIALMEDIA_TWITTER",VIDEO,,,"containsVideo,hasImage,isNewsHost,isQuestion,isVerifiedAuthor,isVerifiedSource",,,"[{""display_url"":""pic.twitter.com/ECBlR6mSnh"",""expanded_url"":""https://twitter.com/NWSNewOrleans/status/1298015026888888321/photo/1"",""url"":""https://t.co/ECBlR6mSnh""}]",http://pbs.twimg.com/tweet_video_thumb/EgN5wrqU4AASKYR.jpg,0,0,,https://video.twimg.com/tweet_video/EgN5wrqU4AASKYR.mp4,0,0,,,SEARCH /  / hurricane,0,0,20,0,0,0,0,0,0,0,0,0,0,2091000000,0,39620,0,0,North America,United States,us,Louisiana,New Orleans,-90.0384521484375,29.99542236328125,tw:594736235,,NWS New Orleans,0,DAY,MALE,http://pbs.twimg.com/profile_images/875669327453667330/SYXeEdlC_normal.jpg,NWSNewOrleans,http://twitter.com/NWSNewOrleans/,North America,United States,us,Louisiana,New Orleans,-90.0384521484375,29.99542236328125,North America,United States,us,Louisiana,New Orleans,-90.0384521484375,29.99542236328125,52,39620,,MOBILE_OTHER,214681744,32,Official Twitter account for the National Weather Service New Orleans. Details: http://weather.gov/twitter,0,NWS New Orleans,33,
http://twitter.com/NWSNewOrleans/status/1298011050525130753,24/08/20 15:37:35,24/08/20 15:35:24,24/08/20 15:37:40,,"🌀 Latest 4PM CDT Update on both Tropical Storm #Marco and #Laura. TS #Marco continues to remain very weak, with an expected landfall later this evening along the MS Delta. All eyes still on #Laura for later this week, as impacts remain possible. Stay weather aware!! #lawx #mswx pic.twitter.com/U6MlxHAiOA",,"🌀 Latest 4PM CDT Update on both Tropical Storm #Marco and #Laura. TS #Marco continues to remain very weak, with an expected landfall later this evening along the MS Delta. All eyes still on #Laura for later this week, as impacts remain possible. Stay weather aware!! #lawx #mswx https://t.co/U6MlxHAiOA",http://twitter.com/NWSNewOrleans/,http://twitter.com/,http://twitter.com/,http://twitter.com/NWSNewOrleans/status/1298011050525130753,en,0,66,0,0,"SOCIALMEDIA,SOCIALMEDIA_TWITTER",IMAGE,,,"containsImage,hasImage,isNewsHost,isVerifiedAuthor,isVerifiedSource",,,"[{""display_url"":""pic.twitter.com/U6MlxHAiOA"",""expanded_url"":""https://twitter.com/NWSNewOrleans/status/1298011050525130753/photo/1"",""url"":""https://t.co/U6MlxHAiOA""}]",http://pbs.twimg.com/media/EgN2KsxVAAAtlrH.jpg,0,0,,,0,0,,,SEARCH /  / hurricane,0,0,30,0,0,0,0,0,0,0,0,0,0,2091000000,0,39617,0,0,North America,United States,us,Louisiana,New Orleans,-90.0384521484375,29.99542236328125,tw:594736235,,NWS New Orleans,0,DAY,MALE,http://pbs.twimg.com/profile_images/875669327453667330/SYXeEdlC_normal.jpg,NWSNewOrleans,http://twitter.com/NWSNewOrleans/,North America,United States,us,Louisiana,New Orleans,-90.0384521484375,29.99542236328125,North America,United States,us,Louisiana,New Orleans,-90.0384521484375,29.99542236328125,68,39617,,MOBILE_OTHER,214681744,38,Official Twitter account for the National Weather Service New Orleans. Details: http://weather.gov/twitter,0,NWS New Orleans,48,
http://twitter.com/TeDay_3/status/1297917947567058949,24/08/20 09:26:11,24/08/20 09:25:27,24/08/20 09:26:15,,@shakori_kae I need hurricane snacks,,@shakori_kae I need hurricane snacks,http://twitter.com/TeDay_3/,http://twitter.com/,http://twitter.com/,http://twitter.com/shakori_kae/status/1297901556168261636,en,0,100,0,0,"SOCIALMEDIA,SOCIALMEDIA_TWITTER",TEXT,,,"isComment,isNewsHost,isTwitterReply",,,[],,0,0,,,0,0,,,SEARCH /  / hurricane,0,0,0,0,0,0,0,0,0,0,0,0,0,2091000000,0,1440,0,0,North America,United States,us,Louisiana,"Baton Rouge, Louisiana",-91.1370849609375,30.45684814453125,tw:229191511,,Torrey Smith,0,DAY,MALE,http://pbs.twimg.com/profile_images/1269881691125846022/CbmuBzrQ_normal.jpg,TeDay_3,http://twitter.com/TeDay_3/,North America,United States,us,Louisiana,"Baton Rouge, Louisiana",-91.1370849609375,30.45684814453125,North America,United States,us,Louisiana,"Baton Rouge, Louisiana",-91.1370849609375,30.45684814453125,1,1440,,MOBILE_IOS,214681744,1,#UL Civil Engineering Major ⚫️ Brand Ambassador ⚫️ Real Estate Student ⚫️ Aspiring Entrepreneur⚫️ Former D1 Athlete IG: Teaux_3,0,Torrey Smith,5,
http://twitter.com/BRProudNews/status/1298085231908585474,24/08/20 20:30:29,24/08/20 20:30:11,24/08/20 20:30:35,,"Sand bag locations are still available for Tropical Storm Laura, link for locations in the story trib.al/9G6qHyg",,"Sand bag locations are still available for Tropical Storm Laura, link for locations in the story https://t.co/cjFQ8kFM3F",http://twitter.com/BRProudNews/,http://twitter.com/,http://twitter.com/,http://twitter.com/BRProudNews/status/1298085231908585474,en,0,100,0,0,"SOCIALMEDIA,SOCIALMEDIA_TWITTER",LINK,,,isNewsHost,,,"[{""display_url"":""trib.al/9G6qHyg"",""expanded_url"":""https://trib.al/9G6qHyg"",""url"":""https://t.co/cjFQ8kFM3F""}]",,0,0,,,0,0,,,SEARCH /  / hurricane,0,0,0,0,0,0,0,0,0,0,0,0,0,2091000000,0,3815,0,0,North America,United States,us,Louisiana,"Baton Rouge, Louisiana",-91.1370849609375,30.45684814453125,tw:267750292,,BRProud,0,DAY,UNKNOWN,http://pbs.twimg.com/profile_images/1228067316480565248/hVSbaseg_normal.jpg,BRProudNews,http://twitter.com/BRProudNews/,North America,United States,us,Louisiana,"Baton Rouge, Louisiana",-91.1370849609375,30.45684814453125,North America,United States,us,Louisiana,"Baton Rouge, Louisiana",-91.1370849609375,30.45684814453125,0,3815,,EXTERNAL_WEBSITE,214681744,0,We are Baton Rouge proud. Powered by WVLA NBC Local 33 and WGMB FOX 44,0,BRProud,17,
http://twitter.com/AdamdotH/status/1297890502180851713,24/08/20 08:06:05,24/08/20 07:36:24,24/08/20 08:06:19,,communing with the ancient spirits for guidance ahead of a double hurricane week pic.twitter.com/QxIlkZBfrx,,communing with the ancient spirits for guidance ahead of a double hurricane week https://t.co/QxIlkZBfrx,http://twitter.com/AdamdotH/,http://twitter.com/,http://twitter.com/,http://twitter.com/AdamdotH/status/1297890502180851713,en,0,100,0,0,"SOCIALMEDIA,SOCIALMEDIA_TWITTER",IMAGE,,,"containsImage,hasImage,isNewsHost",,,"[{""display_url"":""pic.twitter.com/QxIlkZBfrx"",""expanded_url"":""https://twitter.com/AdamdotH/status/1297890502180851713/photo/1"",""url"":""https://t.co/QxIlkZBfrx""}]",http://pbs.twimg.com/media/EgMIg2dWsAYpuwx.jpg,0,0,,,0,0,,,SEARCH /  / hurricane,0,0,2,0,0,0,0,0,0,0,0,0,0,2091000000,0,2332,0,0,North America,United States,us,Louisiana,"Baton Rouge, Louisiana",-91.1370849609375,30.45684814453125,tw:57852556,,sir this is an albies,0,DAY,MALE,http://pbs.twimg.com/profile_images/1237452762360709122/g3r8xAb8_normal.jpg,AdamdotH,http://twitter.com/AdamdotH/,North America,United States,us,Louisiana,"Baton Rouge, Louisiana",-91.1370849609375,30.45684814453125,North America,United States,us,Louisiana,"Baton Rouge, Louisiana",-91.1370849609375,30.45684814453125,11,2332,,MOBILE_IOS,214681744,9,Wait until the readers of The Daily Punctilio hear about this.,0,sir this is an albies,14,
http://twitter.com/WaterWorksNOLA/status/1297880730245181447,24/08/20 06:58:13,24/08/20 06:57:34,24/08/20 06:58:16,,"#MARCO downgraded, #LAURA upgraded and likely to make landfall Wednesday night. Continue to take #COVID19 precautions — mask up! Rest, stay prepared + safe #NewOrleans. First graphic is RT from @Dave_Nussbaum COVID Hurricane Guide from @WaterWorksNOLA: bit.ly/COVIDHurricane pic.twitter.com/zvcOVwjTL5",,"#MARCO downgraded, #LAURA upgraded and likely to make landfall Wednesday night. Continue to take #COVID19 precautions — mask up! Rest, stay prepared + safe #NewOrleans. First graphic is RT from @Dave_Nussbaum COVID Hurricane Guide from @WaterWorksNOLA: https://t.co/qMyFQPdprs https://t.co/zvcOVwjTL5",http://twitter.com/WaterWorksNOLA/,http://twitter.com/,http://twitter.com/,http://twitter.com/WaterWorksNOLA/status/1297880730245181447,en,0,28,0,0,"SOCIALMEDIA,SOCIALMEDIA_TWITTER",IMAGE,,,"containsImage,hasImage,isNewsHost",,,"[{""display_url"":""pic.twitter.com/zvcOVwjTL5"",""expanded_url"":""https://twitter.com/WaterWorksNOLA/status/1297880730245181447/photo/1"",""url"":""https://t.co/zvcOVwjTL5""},{""display_url"":""bit.ly/COVIDHurricane"",""expanded_url"":""http://bit.ly/COVIDHurricane"",""url"":""https://t.co/qMyFQPdprs""}]",http://pbs.twimg.com/media/EgL_oXBWsAAmYh0.jpg,0,0,,,0,0,,,SEARCH /  / hurricane,0,0,1,0,0,0,0,0,0,0,0,0,0,2091000000,0,584,0,0,North America,United States,us,Louisiana,New Orleans,-90.0164794921875,29.98443603515625,tw:2846108951,,Imagine Water Works,0,DAY,UNKNOWN,http://pbs.twimg.com/profile_images/1129843813885911041/v8vqFl-s_normal.jpg,WaterWorksNOLA,http://twitter.com/WaterWorksNOLA/,North America,United States,us,Louisiana,New Orleans,-90.0384521484375,29.99542236328125,North America,United States,us,Louisiana,New Orleans,-90.0384521484375,29.99542236328125,1,584,,MOBILE_IOS,214681744,0,"Reimagining the future through art, science, & connection since 2012. Follow for BIPOC & trans-led disaster response, mutual aid, water & climate justice work.",0,Imagine Water Works,36,
http://twitter.com/WinWithJMC/status/1297851811341176833,24/08/20 05:03:21,24/08/20 05:02:39,24/08/20 05:03:29,,"@AdamBassWCCS @JMilesColeman Crossing our fingers. Marco hasn't strengthened and will likely hug the coast. Laura iffy; it's in Cuba as a TS, and will strengthen. And presently will land along the LA/TX line. Although with Laura (and Marco) we'll probably get lots of rain and Tropical Storm winds.",,"@AdamBassWCCS @JMilesColeman Crossing our fingers. Marco hasn't strengthened and will likely hug the coast. Laura iffy; it's in Cuba as a TS, and will strengthen. And presently will land along the LA/TX line. Although with Laura (and Marco) we'll probably get lots of rain and Tropical Storm winds.",http://twitter.com/WinWithJMC/,http://twitter.com/,http://twitter.com/,http://twitter.com/AdamBassWCCS/status/1297733686234947584,en,0,100,0,0,"SOCIALMEDIA,SOCIALMEDIA_TWITTER",TEXT,,,"isComment,isNewsHost,isTwitterReply",,,[],,0,0,,,0,0,,,SEARCH /  / hurricane,0,0,0,0,0,0,0,0,0,0,0,0,0,2091000000,0,6898,0,0,North America,United States,us,Louisiana,"Baton Rouge, Louisiana",-91.1370849609375,30.45684814453125,tw:861719988,,John Couvillon,0,DAY,MALE,http://pbs.twimg.com/profile_images/2680587752/f45c33b21d16f05ed37b28ea226c2923_normal.jpeg,WinWithJMC,http://twitter.com/WinWithJMC/,North America,United States,us,Louisiana,"Baton Rouge, Louisiana",-91.1370849609375,30.45684814453125,North America,United States,us,Louisiana,"Baton Rouge, Louisiana",-91.1370849609375,30.45684814453125,1,6898,,MOBILE_OTHER,214681744,1,"Founder of JMC Analytics and Polling (2020 Campaign and Elections' Reed Awards finalist in polling), political strategist, and in general, ""the numbers guy.""",0,John Couvillon,49,
http://twitter.com/Kheri__Ty/status/1297912957620420609,24/08/20 09:07:07,24/08/20 09:05:37,24/08/20 09:07:12,,@taylor_e_cherry in person??? during a hurricane? chileeee,,@taylor_e_cherry in person??? during a hurricane? chileeee,http://twitter.com/Kheri__Ty/,http://twitter.com/,http://twitter.com/,http://twitter.com/taylor_e_cherry/status/1297912706910101504,en,0,9,0,0,"SOCIALMEDIA,SOCIALMEDIA_TWITTER",TEXT,,,"isQuestion,isComment,isTwitterReply,isNewsHost",,,[],,0,0,,,0,0,,,SEARCH /  / hurricane,0,0,1,0,0,0,0,0,0,0,0,0,0,2091000000,0,1112,0,0,North America,United States,us,Louisiana,New Orleans,-90.0384521484375,29.99542236328125,tw:1028768902065651715,,Kheri’,0,DAY,FEMALE,http://pbs.twimg.com/profile_images/1291572404662214656/ZgIvOiNi_normal.jpg,Kheri__Ty,http://twitter.com/Kheri__Ty/,North America,United States,us,Louisiana,New Orleans,-90.0384521484375,29.99542236328125,North America,United States,us,Louisiana,New Orleans,-90.0384521484375,29.99542236328125,2,1112,,MOBILE_IOS,214681744,1,She/Her | Pisces | XULA | sc: sweetre2 | 318 | 1/2 CEO of @looksbylnk | @karingtouchsoap,0,Kheri’,7,
http://twitter.com/CEStephens/status/1298035081450262528,24/08/20 17:11:32,24/08/20 17:10:54,24/08/20 17:11:41,,"State offices in Louisiana will close only in areas where there are mandatory evacuations on Tuesday. @LouisianaGov says statewide office closures are likely for Wednesday and Thursday, but he will make that call based on tomorrow’s forecast for Tropical Storm Laura.",,"State offices in Louisiana will close only in areas where there are mandatory evacuations on Tuesday. @LouisianaGov says statewide office closures are likely for Wednesday and Thursday, but he will make that call based on tomorrow’s forecast for Tropical Storm Laura.",http://twitter.com/CEStephens/,http://twitter.com/,http://twitter.com/,http://twitter.com/CEStephens/status/1298034622027137024,en,0,100,0,0,"SOCIALMEDIA,SOCIALMEDIA_TWITTER",TEXT,,,"isComment,isNewsHost,isTwitterReply",,,[],,0,0,,,0,0,,,SEARCH /  / hurricane,0,0,1,0,0,0,0,0,0,0,0,0,0,2091000000,0,4843,0,0,North America,United States,us,Louisiana,"Baton Rouge, Louisiana",-91.0931396484375,30.45684814453125,tw:14982131,,Christina “MASK UP” Stephens,0,DAY,FEMALE,http://pbs.twimg.com/profile_images/1267219713710600193/7iLBci5x_normal.jpg,CEStephens,http://twitter.com/CEStephens/,North America,United States,us,Louisiana,"Baton Rouge, Louisiana",-91.1370849609375,30.45684814453125,North America,United States,us,Louisiana,"Baton Rouge, Louisiana",-91.1370849609375,30.45684814453125,2,4843,,MOBILE_IOS,214681744,1,Deputy COS/Comms for @LouisianaGov • Leopard Print is Not Tiger Stripes • Lover of the Louisiana Life • #ForeverLSU • #WhoDat • Tweets are very much my own.,0,Christina “MASK UP” Stephens,41,
http://twitter.com/KALBtv5/status/1297926659660746752,24/08/20 10:58:16,24/08/20 10:00:04,24/08/20 10:58:23,,Important update on TROPICAL STORM MARCO from Chief Meteorologist Tom Konvicka: kalb.com/2020/08/24/you…,,Important update on TROPICAL STORM MARCO from Chief Meteorologist Tom Konvicka: https://t.co/UwD4t0bSnx,http://twitter.com/KALBtv5/,http://twitter.com/,http://twitter.com/,http://twitter.com/KALBtv5/status/1297926659660746752,en,0,75,0,0,"SOCIALMEDIA,SOCIALMEDIA_TWITTER",LINK,,,"isNewsHost,isVerifiedAuthor,isVerifiedSource",,,"[{""display_url"":""kalb.com/2020/08/24/you…"",""expanded_url"":""https://www.kalb.com/2020/08/24/your-local-tropical-weather-resource-blog/"",""url"":""https://t.co/UwD4t0bSnx""}]",,0,0,,,0,0,,,SEARCH /  / hurricane,0,0,1,0,0,0,0,0,0,0,0,0,0,2091000000,0,12845,0,0,North America,United States,us,Louisiana,"Alexandria, Louisiana",-92.4444580078125,31.31378173828125,tw:99127272,,KALB News Channel 5,0,DAY,UNKNOWN,http://pbs.twimg.com/profile_images/1225116498211098626/SwaueJcv_normal.jpg,KALBtv5,http://twitter.com/KALBtv5/,North America,United States,us,Louisiana,"Alexandria, Louisiana",-92.4444580078125,31.31378173828125,North America,United States,us,Louisiana,"Alexandria, Louisiana",-92.4444580078125,31.31378173828125,1,12845,,EXTERNAL_WEBSITE,214681744,0,,0,KALB News Channel 5,12,
http://twitter.com/jdbrechtel/status/1297815720206770177,24/08/20 02:39:40,24/08/20 02:39:14,24/08/20 02:39:58,,@ElliotEdward2 Gonna be an interesting next few days here in my neck of the woods in SE LA. Hurricane/TS Marco effects start today though I think we'll be fine from that. Eventual Hurricane Laura is very concerning in a day or two.,,@ElliotEdward2 Gonna be an interesting next few days here in my neck of the woods in SE LA. Hurricane/TS Marco effects start today though I think we'll be fine from that. Eventual Hurricane Laura is very concerning in a day or two.,http://twitter.com/jdbrechtel/,http://twitter.com/,http://twitter.com/,http://twitter.com/ElliotEdward2/status/1297728207387590664,en,0,100,0,0,"SOCIALMEDIA,SOCIALMEDIA_TWITTER",TEXT,,,"isComment,isNewsHost,isTwitterReply",,,[],,0,0,,,0,0,,,SEARCH /  / hurricane,0,0,0,0,0,0,0,0,0,0,0,0,0,2091000000,0,191,0,0,North America,United States,us,Louisiana,"Mandeville, Louisiana",-90.0823974609375,30.36895751953125,tw:35741525,,Jack Brechtel,0,DAY,MALE,http://pbs.twimg.com/profile_images/1297534952603623424/E-PAKNJT_normal.jpg,jdbrechtel,http://twitter.com/jdbrechtel/,North America,United States,us,Louisiana,"Mandeville, Louisiana",-90.0823974609375,30.36895751953125,North America,United States,us,Louisiana,"Mandeville, Louisiana",-90.0823974609375,30.36895751953125,0,191,,MOBILE_OTHER,214681744,0,"IT professional, endurance runner, wine/beer drinker, funk/jazz listener, book worm, sports follower, video game admirer | https://www.instagram.com/jdbrechtel/",0,Jack Brechtel,43,
http://twitter.com/SteveWAFB/status/1298003774754238465,24/08/20 15:06:52,24/08/20 15:06:30,24/08/20 15:06:59,,A TROPICAL STORM WATCH has been issued for the areas in blue. Tropical storm force winds are possible within 48 hours or less. pic.twitter.com/IoO9yfV3Cd,,A TROPICAL STORM WATCH has been issued for the areas in blue. Tropical storm force winds are possible within 48 hours or less. https://t.co/IoO9yfV3Cd,http://twitter.com/SteveWAFB/,http://twitter.com/,http://twitter.com/,http://twitter.com/SteveWAFB/status/1298003774754238465,en,0,100,0,0,"SOCIALMEDIA,SOCIALMEDIA_TWITTER",IMAGE,,,"containsImage,hasImage,isNewsHost,isVerifiedAuthor,isVerifiedSource",,,"[{""display_url"":""pic.twitter.com/IoO9yfV3Cd"",""expanded_url"":""https://twitter.com/SteveWAFB/status/1298003774754238465/photo/1"",""url"":""https://t.co/IoO9yfV3Cd""}]",http://pbs.twimg.com/media/EgNvjc3WsAAvNiF.jpg,0,0,,,0,0,,,SEARCH /  / hurricane,0,0,0,0,0,0,0,0,0,0,0,0,0,2091000000,0,11426,0,0,North America,United States,us,Louisiana,"Baton Rouge, Louisiana",-91.1370849609375,30.45684814453125,tw:17378355,,"Steve Caparotta, Ph.D.",0,DAY,MALE,http://pbs.twimg.com/profile_images/1029418168413040641/nP31cRTe_normal.jpg,SteveWAFB,http://twitter.com/SteveWAFB/,North America,United States,us,Louisiana,"Baton Rouge, Louisiana",-91.1370849609375,30.45684814453125,North America,United States,us,Louisiana,"Baton Rouge, Louisiana",-91.1370849609375,30.45684814453125,0,11426,,EXTERNAL_WEBSITE,214681744,0,AMS certified meteorologist at @WAFB in Baton Rouge. Husband. Dad to 2 girls. B.S. in Meteorology from @UofSouthAlabama. M.S. & Ph.D from @LSU. #NOLA native.,0,"Steve Caparotta, Ph.D.",24,
http://twitter.com/ghettoloveeee/status/1297998990731075590,24/08/20 14:48:18,24/08/20 14:47:29,24/08/20 14:48:22,,"My job talking bout we got work tomorrow,ain’t a hurricane around here somewhere!",,"My job talking bout we got work tomorrow,ain’t a hurricane around here somewhere!",http://twitter.com/ghettoloveeee/,http://twitter.com/,http://twitter.com/,http://twitter.com/ghettoloveeee/status/1297998990731075590,en,0,100,0,-5,"SOCIALMEDIA,SOCIALMEDIA_TWITTER",TEXT,,,isNewsHost,,,[],,0,0,,,0,0,,,SEARCH /  / hurricane,0,0,0,0,0,0,0,0,0,0,0,0,0,2091000000,0,730,0,0,North America,United States,us,Louisiana,"Baton Rouge, Louisiana",-91.1370849609375,30.45684814453125,tw:64126504,,Children Of The Swamp 🐊,0,DAY,MALE,http://pbs.twimg.com/profile_images/1269151028995403776/i7d2MKZm_normal.jpg,ghettoloveeee,http://twitter.com/ghettoloveeee/,North America,United States,us,Louisiana,"Baton Rouge, Louisiana",-91.1370849609375,30.45684814453125,North America,United States,us,Louisiana,"Baton Rouge, Louisiana",-91.1370849609375,30.45684814453125,0,730,,MOBILE_IOS,214681744,0,ARIES!!,0,Children Of The Swamp 🐊,14,
http://twitter.com/bbgulfstates/status/1297914064488865799,24/08/20 09:10:41,24/08/20 09:10:01,24/08/20 09:10:43,,"It is essential to be prepared as the storms in the Gulf continue to strengthen, check out our Hurricane Guide for additional preparedness tips at loom.ly/_pr-pr8 #hurricaneseason #tropicalstorms #gulfcoast #prep pic.twitter.com/llpBqddPe0",,"It is essential to be prepared as the storms in the Gulf continue to strengthen, check out our Hurricane Guide for additional preparedness tips at https://t.co/t9TMC0QhzP #hurricaneseason #tropicalstorms #gulfcoast #prep https://t.co/llpBqddPe0",http://twitter.com/bbgulfstates/,http://twitter.com/,http://twitter.com/,http://twitter.com/bbgulfstates/status/1297914064488865799,en,0,61,0,0,"SOCIALMEDIA,SOCIALMEDIA_TWITTER",IMAGE,,,"containsImage,hasImage,isNewsHost",,,"[{""display_url"":""pic.twitter.com/llpBqddPe0"",""expanded_url"":""https://twitter.com/bbgulfstates/status/1297914064488865799/photo/1"",""url"":""https://t.co/llpBqddPe0""},{""display_url"":""loom.ly/_pr-pr8"",""expanded_url"":""https://loom.ly/_pr-pr8"",""url"":""https://t.co/t9TMC0QhzP""}]",http://pbs.twimg.com/media/EgMd9ndXgAIU6K-.jpg,0,0,,,0,0,,,SEARCH /  / hurricane,0,0,0,0,0,0,0,0,0,0,0,0,0,2091000000,0,60,0,0,North America,United States,us,Louisiana,"Baton Rouge, Louisiana",-91.1370849609375,30.45684814453125,tw:908819339347820545,,bbgulfstates,0,DAY,UNKNOWN,http://pbs.twimg.com/profile_images/1092478526182305793/q6P9FncS_normal.jpg,bbgulfstates,http://twitter.com/bbgulfstates/,North America,United States,us,Louisiana,"Baton Rouge, Louisiana",-91.1370849609375,30.45684814453125,North America,United States,us,Louisiana,"Baton Rouge, Louisiana",-91.1370849609375,30.45684814453125,0,60,,EXTERNAL_WEBSITE,214681744,0,"Agile Insurance solutions that rise above any challenge. For your business, your people, and your home.",0,bbgulfstates,31,
http://twitter.com/WomansHospital/status/1297973198160449536,24/08/20 14:00:18,24/08/20 13:05:00,24/08/20 14:00:25,,"With two storms expected to impact Louisiana in the middle of a global health-pandemic, it is important for expecting mothers to have a hurricane plan in place. Check out our latest blog for some tips! 🔗 blogs.womans.org/hurricane-prep… pic.twitter.com/Ifo0foBKel",,"With two storms expected to impact Louisiana in the middle of a global health-pandemic, it is important for expecting mothers to have a hurricane plan in place. Check out our latest blog for some tips! 🔗 https://t.co/IHUV0F3eYM https://t.co/Ifo0foBKel",http://twitter.com/WomansHospital/,http://twitter.com/,http://twitter.com/,http://twitter.com/WomansHospital/status/1297973198160449536,en,0,100,0,0,"SOCIALMEDIA,SOCIALMEDIA_TWITTER",IMAGE,,,"containsImage,hasImage,isNewsHost",,,"[{""display_url"":""pic.twitter.com/Ifo0foBKel"",""expanded_url"":""https://twitter.com/WomansHospital/status/1297973198160449536/photo/1"",""url"":""https://t.co/Ifo0foBKel""},{""display_url"":""blogs.womans.org/hurricane-prep…"",""expanded_url"":""http://blogs.womans.org/hurricane-prep-for-pregnant-moms-2/"",""url"":""https://t.co/IHUV0F3eYM""}]",http://pbs.twimg.com/media/EgNBiCdWkAMPJcC.jpg,0,0,,,0,0,,,SEARCH /  / hurricane,0,0,1,0,0,0,0,0,0,0,0,0,0,2091000000,0,2645,0,0,North America,United States,us,Louisiana,"Baton Rouge, Louisiana",-91.1370849609375,30.45684814453125,tw:20534901,,WomansHospital,0,DAY,UNKNOWN,http://pbs.twimg.com/profile_images/905525622578880512/1FiZC9_Q_normal.jpg,WomansHospital,http://twitter.com/WomansHospital/,North America,United States,us,Louisiana,"Baton Rouge, Louisiana",-91.1370849609375,30.45684814453125,North America,United States,us,Louisiana,"Baton Rouge, Louisiana",-91.1370849609375,30.45684814453125,1,2645,,MOBILE_OTHER,214681744,0,"Woman's Hospital - Exceptional Care, Centered on You",0,WomansHospital,38,
