http://twitter.com/pwsklanewor90/status/1298092560225693696,24/08/20 20:59:45,24/08/20 20:59:18,24/08/20 20:59:52,,LIX continues Tropical Storm Watch for Upper Lafourche [LA] until further notice mesonet.agron.iastate.edu/vtec/f/2020-O-…,,LIX continues Tropical Storm Watch for Upper Lafourche [LA] until further notice https://t.co/7nMHuMvtXK,http://twitter.com/pwsklanewor90/,http://twitter.com/,http://twitter.com/,http://twitter.com/pwsklanewor90/status/1298092560225693696,en,0,58,0,0,"SOCIALMEDIA,SOCIALMEDIA_TWITTER",LINK,,,isNewsHost,,,"[{""display_url"":""mesonet.agron.iastate.edu/vtec/f/2020-O-…"",""expanded_url"":""https://mesonet.agron.iastate.edu/vtec/f/2020-O-CON-KLIX-TR-A-1013_2020-08-25T02:59Z"",""url"":""https://t.co/7nMHuMvtXK""}]",,0,0,,,0,0,,,SEARCH /  / hurricane,0,0,0,0,0,0,0,0,0,0,0,0,0,2091000000,0,5,0,0,North America,United States,us,Louisiana,New Orleans,-90.0384521484375,29.99542236328125,tw:954529739888263169,,PWSKLANEWOR90,0,DAY,UNKNOWN,http://pbs.twimg.com/profile_images/954530123532783616/IOz8A2jw_normal.jpg,pwsklanewor90,http://twitter.com/pwsklanewor90/,North America,United States,us,Louisiana,New Orleans,-90.0384521484375,29.99542236328125,North America,United States,us,Louisiana,New Orleans,-90.0384521484375,29.99542236328125,0,5,,BOT,214681744,0,Personal Weather Station   Weather Underground: http://bit.ly/2DrEBwg    Radio Station: KG5WBN,0,PWSKLANEWOR90,13,
http://twitter.com/riccomarch76/status/1297827766683934720,24/08/20 03:27:36,24/08/20 03:27:06,24/08/20 03:27:44,,LIX cancels Tropical Storm Warning for Ascension [LA] mesonet.agron.iastate.edu/vtec/f/2020-O-…,,LIX cancels Tropical Storm Warning for Ascension [LA] https://t.co/BdxS8OAgPu,http://twitter.com/riccomarch76/,http://twitter.com/,http://twitter.com/,http://twitter.com/riccomarch76/status/1297827766683934720,en,0,36,0,-5,"SOCIALMEDIA,SOCIALMEDIA_TWITTER",LINK,,,isNewsHost,,,"[{""display_url"":""mesonet.agron.iastate.edu/vtec/f/2020-O-…"",""expanded_url"":""https://mesonet.agron.iastate.edu/vtec/f/2020-O-CAN-KLIX-TR-W-1014_2020-08-24T09:26Z"",""url"":""https://t.co/BdxS8OAgPu""}]",,0,0,,,0,0,,,SEARCH /  / hurricane,0,0,0,0,0,0,0,0,0,0,0,0,0,2091000000,0,119,0,0,North America,United States,us,Louisiana,New Orleans,-90.0384521484375,29.99542236328125,tw:4791973416,,Ricco March,0,DAY,MALE,http://pbs.twimg.com/profile_images/1245793718923333632/MnOQ-bEn_normal.jpg,riccomarch76,http://twitter.com/riccomarch76/,North America,United States,us,Louisiana,New Orleans,-90.0384521484375,29.99542236328125,North America,United States,us,Louisiana,New Orleans,-90.0384521484375,29.99542236328125,0,119,,BOT,214681744,0,,0,Ricco March,9,
http://twitter.com/iembot_lix/status/1297964877630148610,24/08/20 12:32:28,24/08/20 12:31:56,24/08/20 12:32:45,,LIX cancels Tropical Storm Warning for Upper Lafourche [LA] mesonet.agron.iastate.edu/vtec/f/2020-O-…,,LIX cancels Tropical Storm Warning for Upper Lafourche [LA] https://t.co/KWQEbX12lT,http://twitter.com/iembot_lix/,http://twitter.com/,http://twitter.com/,http://twitter.com/iembot_lix/status/1297964877630148610,en,0,43,0,0,"SOCIALMEDIA,SOCIALMEDIA_TWITTER",LINK,,,isNewsHost,,,"[{""display_url"":""mesonet.agron.iastate.edu/vtec/f/2020-O-…"",""expanded_url"":""https://mesonet.agron.iastate.edu/vtec/f/2020-O-CAN-KLIX-TR-W-1014_2020-08-24T18:31Z"",""url"":""https://t.co/KWQEbX12lT""}]",,0,0,,,0,0,,,SEARCH /  / hurricane,0,0,0,0,0,0,0,0,0,0,0,0,0,2091000000,0,191,0,0,North America,United States,us,Louisiana,New Orleans,-90.0384521484375,29.99542236328125,tw:34917996,,IEMBot LIX,0,DAY,UNKNOWN,http://pbs.twimg.com/profile_images/187517439/bender-smoking2_normal.jpg,iembot_lix,http://twitter.com/iembot_lix/,North America,United States,us,Louisiana,New Orleans,-90.0384521484375,29.99542236328125,North America,United States,us,Louisiana,New Orleans,-90.0384521484375,29.99542236328125,0,191,,BOT,214681744,0,"Syndication of National Weather Service Office New Orleans, LA. Unmonitored, contact @akrherz who developed this.",0,IEMBot LIX,10,
http://twitter.com/Q_IsNerdy/status/1297969360519258112,24/08/20 12:50:09,24/08/20 12:49:45,24/08/20 12:50:17,,Annoying. I was expecting a hurricane,,Annoying. I was expecting a hurricane,http://twitter.com/Q_IsNerdy/,http://twitter.com/,http://twitter.com/,http://twitter.com/Q_IsNerdy/status/1297969360519258112,en,0,100,0,-5,"SOCIALMEDIA,SOCIALMEDIA_TWITTER",TEXT,,,isNewsHost,,,[],,0,0,,,0,0,,,SEARCH /  / hurricane,0,0,0,0,0,0,0,0,0,0,0,0,0,2091000000,0,508,0,0,North America,United States,us,Louisiana,New Orleans,-90.0384521484375,29.99542236328125,tw:94957006,,Quist V.2,0,DAY,FEMALE,http://pbs.twimg.com/profile_images/1293740548323450881/i-XJ449P_normal.jpg,Q_IsNerdy,http://twitter.com/Q_IsNerdy/,North America,United States,us,Louisiana,New Orleans,-90.0384521484375,29.99542236328125,North America,United States,us,Louisiana,New Orleans,-90.0384521484375,29.99542236328125,0,508,,MOBILE_IOS,214681744,0,Send switch friend codes,0,Quist V.2,6,
http://twitter.com/NWSNewOrleans/status/1298105383890718720,24/08/20 21:50:54,24/08/20 21:50:15,24/08/20 21:51:09,,It is late but for any of you night owls we will do a Facebook Live at 11pm to provide a quick up on Tropical Storm Laura facebook.com/NWSNewOrleans/…,,It is late but for any of you night owls we will do a Facebook Live at 11pm to provide a quick up on Tropical Storm Laura https://t.co/UD5OtQty5A,http://twitter.com/NWSNewOrleans/,http://twitter.com/,http://twitter.com/,http://twitter.com/NWSNewOrleans/status/1298105383890718720,en,0,100,0,0,"SOCIALMEDIA,SOCIALMEDIA_TWITTER",LINK,,,"isNewsHost,isVerifiedAuthor,isVerifiedSource",,,"[{""display_url"":""facebook.com/NWSNewOrleans/…"",""expanded_url"":""https://www.facebook.com/NWSNewOrleans/live/"",""url"":""https://t.co/UD5OtQty5A""}]",,0,0,,,0,0,,,SEARCH /  / hurricane,0,0,6,0,0,0,0,0,0,0,0,0,0,2091000000,0,39666,0,0,North America,United States,us,Louisiana,New Orleans,-90.0384521484375,29.99542236328125,tw:594736235,,NWS New Orleans,0,DAY,MALE,http://pbs.twimg.com/profile_images/875669327453667330/SYXeEdlC_normal.jpg,NWSNewOrleans,http://twitter.com/NWSNewOrleans/,North America,United States,us,Louisiana,New Orleans,-90.0384521484375,29.99542236328125,North America,United States,us,Louisiana,New Orleans,-90.0384521484375,29.99542236328125,30,39666,,PC,214681744,24,Official Twitter account for the National Weather Service New Orleans. Details: http://weather.gov/twitter,0,NWS New Orleans,28,
http://twitter.com/CAUW/status/1297982191293652998,24/08/20 13:41:06,24/08/20 13:40:44,24/08/20 13:41:10,,"With the potential threats presented by Tropical Storm Laura, we have made the decision to postpone our virtual Annual Meeting that was going to be held Thursday, August 27th to refocus on potential impacts. We will communicate the rescheduled date soon. #LiveUnited pic.twitter.com/4UFPnSau7u",,"With the potential threats presented by Tropical Storm Laura, we have made the decision to postpone our virtual Annual Meeting that was going to be held Thursday, August 27th to refocus on potential impacts. We will communicate the rescheduled date soon. #LiveUnited https://t.co/4UFPnSau7u",http://twitter.com/CAUW/,http://twitter.com/,http://twitter.com/,http://twitter.com/CAUW/status/1297982191293652998,en,0,100,0,0,"SOCIALMEDIA,SOCIALMEDIA_TWITTER",IMAGE,,,"containsImage,hasImage,isNewsHost",,,"[{""display_url"":""pic.twitter.com/4UFPnSau7u"",""expanded_url"":""https://twitter.com/CAUW/status/1297982191293652998/photo/1"",""url"":""https://t.co/4UFPnSau7u""}]",http://pbs.twimg.com/media/EgNb67vXkAAzWnN.jpg,0,0,,,0,0,,,SEARCH /  / hurricane,0,0,0,0,0,0,0,0,0,0,0,0,0,2091000000,0,1494,0,0,North America,United States,us,Louisiana,"Baton Rouge, Louisiana",-91.1370849609375,30.45684814453125,tw:19604036,,Capital Area United Way,0,DAY,MALE,http://pbs.twimg.com/profile_images/839569732713889792/vV8eXzSN_normal.jpg,CAUW,http://twitter.com/CAUW/,North America,United States,us,Louisiana,"Baton Rouge, Louisiana",-91.1370849609375,30.45684814453125,North America,United States,us,Louisiana,"Baton Rouge, Louisiana",-91.1370849609375,30.45684814453125,0,1494,,MOBILE_OTHER,214681744,0,"We fight for the health, education, income stability and basic needs of every person in our 10-parish community.  http://cauw.org/freshfood",0,Capital Area United Way,43,
http://twitter.com/Tara_317/status/1297925289675304960,24/08/20 09:54:59,24/08/20 09:54:38,24/08/20 09:55:07,,@JimCantore Hi Jim! Live in Lafourche Parish. Where should we evaluate to? Looks like Laura’ll still be a hurricane in Shrieveport. East is getting hit now w/Marco. Both storms headed west. Scary that you’re in NOLA. What’s your educated guess on where would be safest place to go?,,@JimCantore Hi Jim! Live in Lafourche Parish. Where should we evaluate to? Looks like Laura’ll still be a hurricane in Shrieveport. East is getting hit now w/Marco. Both storms headed west. Scary that you’re in NOLA. What’s your educated guess on where would be safest place to go?,http://twitter.com/Tara_317/,http://twitter.com/,http://twitter.com/,http://twitter.com/JimCantore/status/1297839482650144770,en,0,100,0,0,"SOCIALMEDIA,SOCIALMEDIA_TWITTER",TEXT,,,"isQuestion,isComment,isTwitterReply,isNewsHost",,,[],,0,0,,,0,0,,,SEARCH /  / hurricane,0,0,0,0,0,0,0,0,0,0,0,0,0,2091000000,0,148,0,0,North America,United States,us,Louisiana,"Cut Off, Louisiana",-90.3350830078125,29.51751708984375,tw:2269131187,,Tara Callais,0,DAY,FEMALE,http://pbs.twimg.com/profile_images/787212799197970432/-f4xZ_cx_normal.jpg,Tara_317,http://twitter.com/Tara_317/,North America,United States,us,Louisiana,"Cut Off, Louisiana",-90.3350830078125,29.51751708984375,North America,United States,us,Louisiana,"Cut Off, Louisiana",-90.3350830078125,29.51751708984375,0,148,,MOBILE_IOS,214681744,0,,0,Tara Callais,49,
http://twitter.com/riccomarch76/status/1298092560229871618,24/08/20 20:59:43,24/08/20 20:59:18,24/08/20 20:59:53,,LIX continues Tropical Storm Watch for Assumption [LA] until further notice mesonet.agron.iastate.edu/vtec/f/2020-O-…,,LIX continues Tropical Storm Watch for Assumption [LA] until further notice https://t.co/yESKwdE9J6,http://twitter.com/riccomarch76/,http://twitter.com/,http://twitter.com/,http://twitter.com/riccomarch76/status/1298092560229871618,en,0,58,0,0,"SOCIALMEDIA,SOCIALMEDIA_TWITTER",LINK,,,isNewsHost,,,"[{""display_url"":""mesonet.agron.iastate.edu/vtec/f/2020-O-…"",""expanded_url"":""https://mesonet.agron.iastate.edu/vtec/f/2020-O-CON-KLIX-TR-A-1013_2020-08-25T02:59Z"",""url"":""https://t.co/yESKwdE9J6""}]",,0,0,,,0,0,,,SEARCH /  / hurricane,0,0,0,0,0,0,0,0,0,0,0,0,0,2091000000,0,119,0,0,North America,United States,us,Louisiana,New Orleans,-90.0384521484375,29.99542236328125,tw:4791973416,,Ricco March,0,DAY,MALE,http://pbs.twimg.com/profile_images/1245793718923333632/MnOQ-bEn_normal.jpg,riccomarch76,http://twitter.com/riccomarch76/,North America,United States,us,Louisiana,New Orleans,-90.0384521484375,29.99542236328125,North America,United States,us,Louisiana,New Orleans,-90.0384521484375,29.99542236328125,0,119,,BOT,214681744,0,,0,Ricco March,12,
http://twitter.com/iembot_lch/status/1298002462385868803,24/08/20 15:01:46,24/08/20 15:01:17,24/08/20 15:01:47,,LCH issues Hurricane Watch for Jefferson Davis [LA] until further notice mesonet.agron.iastate.edu/vtec/f/2020-O-…,,LCH issues Hurricane Watch for Jefferson Davis [LA] until further notice https://t.co/odnFTXPNhi,http://twitter.com/iembot_lch/,http://twitter.com/,http://twitter.com/,http://twitter.com/iembot_lch/status/1298002462385868803,en,0,58,0,0,"SOCIALMEDIA,SOCIALMEDIA_TWITTER",LINK,,,isNewsHost,,,"[{""display_url"":""mesonet.agron.iastate.edu/vtec/f/2020-O-…"",""expanded_url"":""https://mesonet.agron.iastate.edu/vtec/f/2020-O-NEW-KLCH-HU-A-1013_2020-08-24T21:00Z"",""url"":""https://t.co/odnFTXPNhi""}]",,0,0,,,0,0,,,SEARCH /  / hurricane,0,0,0,0,0,0,0,0,0,0,0,0,0,2091000000,0,106,0,0,North America,United States,us,Louisiana,"Lake Charles, Louisiana",-93.2135009765625,30.22613525390625,tw:34918264,,IEMBot LCH,0,DAY,UNKNOWN,http://pbs.twimg.com/profile_images/184991090/bender-smoking2_normal.jpg,iembot_lch,http://twitter.com/iembot_lch/,North America,United States,us,Louisiana,"Lake Charles, Louisiana",-93.2135009765625,30.22613525390625,North America,United States,us,Louisiana,"Lake Charles, Louisiana",-93.2135009765625,30.22613525390625,0,106,,BOT,214681744,0,"Syndication of National Weather Service Office Lake Charles, LA. Unmonitored, contact @akrherz who developed this.",0,IEMBot LCH,12,
http://twitter.com/DanaBrigoli/status/1298025937448181760,24/08/20 16:34:58,24/08/20 16:34:34,24/08/20 16:35:01,,"@READYF0RlT Oh because of the tropical storm, so they won’t do the zoom class one because of the school’s closure!",,"@READYF0RlT Oh because of the tropical storm, so they won’t do the zoom class one because of the school’s closure!",http://twitter.com/DanaBrigoli/,http://twitter.com/,http://twitter.com/,http://twitter.com/READYF0RlT/status/1298025579585761280,en,0,100,0,-5,"SOCIALMEDIA,SOCIALMEDIA_TWITTER",TEXT,,,"isComment,isNewsHost,isTwitterReply",,,[],,0,0,,,0,0,,,SEARCH /  / hurricane,0,0,0,0,0,0,0,0,0,0,0,0,0,2091000000,0,15259,0,0,North America,United States,us,Louisiana,"Houma, Louisiana",-90.7196044921875,29.58892822265625,tw:2609163074,,"𝓛𝑜𝓋𝑒, Dana✨𝑓𝑜𝑙𝑘𝑙𝑜𝑟𝑒 has to meet Taylor",0,DAY,FEMALE,http://pbs.twimg.com/profile_images/1290781074008813568/rB--8zy1_normal.jpg,DanaBrigoli,http://twitter.com/DanaBrigoli/,North America,United States,us,Louisiana,"Houma, Louisiana",-90.7196044921875,29.58892822265625,North America,United States,us,Louisiana,"Houma, Louisiana",-90.7196044921875,29.58892822265625,1,15259,,MOBILE_IOS,214681744,1,"LOVER FEST WEST 2021! Filipino Swiftie since 2009 🇵🇭TN Followed me on 10/01/18, TS noticed on here, IG, and Tumblr! Drafter/ LSU Computer Engineer ✍️👩🏻‍💻",0,"𝓛𝑜𝓋𝑒, Dana✨𝑓𝑜𝑙𝑘𝑙𝑜𝑟𝑒 has to meet Taylor",20,
http://twitter.com/mariacseger/status/1297921725791862786,24/08/20 09:40:52,24/08/20 09:40:28,24/08/20 09:40:52,,"pandemic, police murder, now impending hurricane: how is anyone here in Lafayette supposed to perform intellectual work in these conditions? send us all your good vibes, please.",,"pandemic, police murder, now impending hurricane: how is anyone here in Lafayette supposed to perform intellectual work in these conditions? send us all your good vibes, please.",http://twitter.com/mariacseger/,http://twitter.com/,http://twitter.com/,http://twitter.com/mariacseger/status/1297921725791862786,en,0,100,0,0,"SOCIALMEDIA,SOCIALMEDIA_TWITTER",TEXT,,,"isNewsHost,isQuestion",,,[],,0,0,,,0,0,,,SEARCH /  / hurricane,0,0,0,0,0,0,0,0,0,0,0,0,0,2091000000,0,356,0,0,North America,United States,us,Louisiana,"Lafayette, Louisiana",-92.0159912109375,30.19866943359375,tw:4166180811,,Maria Seger,0,DAY,FEMALE,http://pbs.twimg.com/profile_images/1019958623953334273/iQLvdKbw_normal.jpg,mariacseger,http://twitter.com/mariacseger/,North America,United States,us,Louisiana,"Lafayette, Louisiana",-92.0159912109375,30.19866943359375,North America,United States,us,Louisiana,"Lafayette, Louisiana",-92.0159912109375,30.19866943359375,15,356,,MOBILE_OTHER,214681744,15,Assistant Professor of English @ULLafayette. Working on a book on extralegal violence and liberal democracy in US culture.,0,Maria Seger,27,
http://twitter.com/WBRZweather/status/1298014930722005004,24/08/20 16:08:22,24/08/20 15:50:50,24/08/20 16:08:24,,"Hurricane, Tropical Storm and Storm Surge Watches have been newly issued in south Louisiana, this time for #Laura. The graphic highlights the included locations and you can follow this link to the latest storm track and local forecast --> wbrz.com/news/the-lates… pic.twitter.com/BLGRK4yCry",,"Hurricane, Tropical Storm and Storm Surge Watches have been newly issued in south Louisiana, this time for #Laura. The graphic highlights the included locations and you can follow this link to the latest storm track and local forecast --> https://t.co/3z8NQsoQ5A https://t.co/BLGRK4yCry",http://twitter.com/WBRZweather/,http://twitter.com/,http://twitter.com/,http://twitter.com/WBRZweather/status/1298014930722005004,en,0,100,0,0,"SOCIALMEDIA,SOCIALMEDIA_TWITTER",IMAGE,,,"containsImage,hasImage,isNewsHost",,,"[{""display_url"":""pic.twitter.com/BLGRK4yCry"",""expanded_url"":""https://twitter.com/WBRZweather/status/1298014930722005004/photo/1"",""url"":""https://t.co/BLGRK4yCry""},{""display_url"":""wbrz.com/news/the-lates…"",""expanded_url"":""https://www.wbrz.com/news/the-latest-gulf-coast-now-sets-eyes-on-laura"",""url"":""https://t.co/3z8NQsoQ5A""}]",http://pbs.twimg.com/media/EgN5sPLXYAQxCEp.jpg,0,0,,,0,0,,,SEARCH /  / hurricane,0,0,5,0,0,0,0,0,0,0,0,0,0,2091000000,0,10132,0,0,North America,United States,us,Louisiana,"Baton Rouge, Louisiana",-91.1370849609375,30.45684814453125,tw:367945799,,WBRZ Weather,0,DAY,UNKNOWN,http://pbs.twimg.com/profile_images/973564157021716481/WdnlB-1c_normal.jpg,WBRZweather,http://twitter.com/WBRZweather/,North America,United States,us,Louisiana,"Baton Rouge, Louisiana",-91.1370849609375,30.45684814453125,North America,United States,us,Louisiana,"Baton Rouge, Louisiana",-91.1370849609375,30.45684814453125,10,10132,,EXTERNAL_WEBSITE,214681744,5,"@WBRZweather has detailed local forecasts, radar updates and the latest weather alerts in the #BatonRouge area!",0,WBRZ Weather,40,
http://twitter.com/cinda_bea/status/1297967955427418121,24/08/20 12:44:40,24/08/20 12:44:10,24/08/20 12:44:42,,Yea my teachers finna get these emails because I’m not doing no work in a hurricane,,Yea my teachers finna get these emails because I’m not doing no work in a hurricane,http://twitter.com/cinda_bea/,http://twitter.com/,http://twitter.com/,http://twitter.com/cinda_bea/status/1297967955427418121,en,0,100,0,-5,"SOCIALMEDIA,SOCIALMEDIA_TWITTER",TEXT,,,isNewsHost,,,[],,0,0,,,0,0,,,SEARCH /  / hurricane,0,0,0,0,0,0,0,0,0,0,0,0,0,2091000000,0,595,0,0,North America,United States,us,Louisiana,"Baton Rouge, Louisiana",-91.1370849609375,30.45684814453125,tw:2518573728,,Jacinda,0,DAY,FEMALE,http://pbs.twimg.com/profile_images/1270922600013758467/RNIrL9c0_normal.jpg,cinda_bea,http://twitter.com/cinda_bea/,North America,United States,us,Louisiana,"Baton Rouge, Louisiana",-91.1370849609375,30.45684814453125,North America,United States,us,Louisiana,"Baton Rouge, Louisiana",-91.1370849609375,30.45684814453125,3,595,,MOBILE_IOS,214681744,3,Earth Sign; Spelmanite,0,Jacinda,16,
http://twitter.com/canrkenz/status/1297975170850869255,24/08/20 13:13:37,24/08/20 13:12:50,24/08/20 13:13:40,,@rachymekos ABOUT TO BE HIT BY A HURRICANE. hope i can receive some help for foods and necessary goods to survive for me and my nephew. $xokenz12,,@rachymekos ABOUT TO BE HIT BY A HURRICANE. hope i can receive some help for foods and necessary goods to survive for me and my nephew. $xokenz12,http://twitter.com/canrkenz/,http://twitter.com/,http://twitter.com/,http://twitter.com/rachymekos/status/1297974785331195904,en,0,100,0,5,"SOCIALMEDIA,SOCIALMEDIA_TWITTER",TEXT,,,"isComment,isTwitterReply,isNewsHost",,,[],,0,0,,,0,0,,,SEARCH /  / hurricane,0,0,0,0,0,0,0,0,0,0,0,0,0,2091000000,0,120,0,0,North America,United States,us,Louisiana,"Baton Rouge, Louisiana",-91.1370849609375,30.45684814453125,tw:1275635499789672452,,protect black trans women❤️🏳️‍🌈✊🏽,0,DAY,MALE,http://pbs.twimg.com/profile_images/1297688734767423488/KrZa3idr_normal.jpg,canrkenz,http://twitter.com/canrkenz/,North America,United States,us,Louisiana,"Baton Rouge, Louisiana",-91.1370849609375,30.45684814453125,North America,United States,us,Louisiana,"Baton Rouge, Louisiana",-91.1370849609375,30.45684814453125,0,120,,MOBILE_IOS,214681744,0,defund the police || #ACAB || $xokenz12 // her/she,0,protect black trans women❤️🏳️‍🌈✊🏽,27,
http://twitter.com/_Waltt_/status/1298042557411332096,24/08/20 17:41:05,24/08/20 17:40:36,24/08/20 17:41:16,,@KidBrenen Bitch he said fuck y’all and that hurricane,,@KidBrenen Bitch he said fuck y’all and that hurricane,http://twitter.com/_Waltt_/,http://twitter.com/,http://twitter.com/,http://twitter.com/KidBrenen/status/1298042379858059264,en,0,100,0,-5,"SOCIALMEDIA,SOCIALMEDIA_TWITTER",TEXT,,,"isComment,isNewsHost,isTwitterReply",,,[],,0,0,,,0,0,,,SEARCH /  / hurricane,0,0,0,0,0,0,0,0,0,0,0,0,0,2091000000,0,1720,0,0,North America,United States,us,Louisiana,New Orleans,-90.0384521484375,29.99542236328125,tw:1163276864292610049,,🧞‍♂️,0,DAY,MALE,http://pbs.twimg.com/profile_images/1248741719954403334/MdhZeR1Z_normal.jpg,_Waltt_,http://twitter.com/_Waltt_/,North America,United States,us,Louisiana,New Orleans,-90.0384521484375,29.99542236328125,North America,United States,us,Louisiana,New Orleans,-90.0384521484375,29.99542236328125,1,1720,,MOBILE_IOS,214681744,1,#lsu23 | ig: waltszn | pmsp scholar | snap: http://walt.tt,0,🧞‍♂️,9,
http://twitter.com/NWSLakeCharles/status/1297993624995557376,24/08/20 14:30:46,24/08/20 14:26:10,24/08/20 14:30:52,,"Good afternoon, everyone. NWS Lake Charles will be hosting a Facebook Live briefing at 4:30 PM this afternoon to discuss the latest track and expected impacts (including new storm surge estimates) for tropical storm Laura. We'll also answer your weather questions.",,"Good afternoon, everyone. NWS Lake Charles will be hosting a Facebook Live briefing at 4:30 PM this afternoon to discuss the latest track and expected impacts (including new storm surge estimates) for tropical storm Laura. We'll also answer your weather questions.",http://twitter.com/NWSLakeCharles/,http://twitter.com/,http://twitter.com/,http://twitter.com/NWSLakeCharles/status/1297993624995557376,en,0,100,0,0,"SOCIALMEDIA,SOCIALMEDIA_TWITTER",TEXT,,,"isNewsHost,isVerifiedAuthor,isVerifiedSource",,,[],,0,0,,,0,0,,,SEARCH /  / hurricane,0,0,1,0,0,0,0,0,0,0,0,0,0,2091000000,0,10956,0,0,North America,United States,us,Louisiana,"Lake Charles, Louisiana",-93.2135009765625,30.22613525390625,tw:590185677,,NWS Lake Charles,0,DAY,MALE,http://pbs.twimg.com/profile_images/675993067782987776/F7gy6Hk6_normal.png,NWSLakeCharles,http://twitter.com/NWSLakeCharles/,North America,United States,us,Louisiana,"Lake Charles, Louisiana",-93.2135009765625,30.22613525390625,North America,United States,us,Louisiana,"Lake Charles, Louisiana",-93.2135009765625,30.22613525390625,4,10956,,PC,214681744,3,"Official Twitter account for the National Weather Service Lake Charles, LA. Details: http://weather.gov/twitter",0,NWS Lake Charles,42,
http://twitter.com/OtiosityACNH/status/1298103657515360257,24/08/20 21:43:57,24/08/20 21:43:24,24/08/20 21:44:13,,update on the hurricane situation: my city hasn’t even gotten rain yet so we big chilled,,update on the hurricane situation: my city hasn’t even gotten rain yet so we big chilled,http://twitter.com/OtiosityACNH/,http://twitter.com/,http://twitter.com/,http://twitter.com/OtiosityACNH/status/1298103657515360257,en,0,100,0,0,"SOCIALMEDIA,SOCIALMEDIA_TWITTER",TEXT,,,isNewsHost,,,[],,0,0,,,0,0,,,SEARCH /  / hurricane,0,0,0,0,0,0,0,0,0,0,0,0,0,2091000000,0,1254,0,0,North America,United States,us,Louisiana,"Baton Rouge, Louisiana",-91.1370849609375,30.45684814453125,tw:1249982944795668481,,Hannah,0,DAY,FEMALE,http://pbs.twimg.com/profile_images/1277498839956668416/U8lEZsYI_normal.jpg,OtiosityACNH,http://twitter.com/OtiosityACNH/,North America,United States,us,Louisiana,"Baton Rouge, Louisiana",-91.1370849609375,30.45684814453125,North America,United States,us,Louisiana,"Baton Rouge, Louisiana",-91.1370849609375,30.45684814453125,3,1254,,MOBILE_IOS,214681744,3,she/her | 🍎 | 22 | northern hemisphere | ♓️ | Paradise | ⭐️ ⭐️⭐️⭐️⭐️ | BLM | i say bad words sometimes | 18+/420 friendly acc | header by @esmelolo1,0,Hannah,16,
http://twitter.com/OkayCharisse/status/1298035890229579776,24/08/20 18:05:56,24/08/20 17:14:07,24/08/20 18:06:01,,"""Hurricane parties are never good idea. They're an absolute horrible idea during COVID."" @LouisianaGov",,"""Hurricane parties are never good idea. They're an absolute horrible idea during COVID."" @LouisianaGov",http://twitter.com/OkayCharisse/,http://twitter.com/,http://twitter.com/,http://twitter.com/OkayCharisse/status/1298035890229579776,en,0,100,0,-5,"SOCIALMEDIA,SOCIALMEDIA_TWITTER",TEXT,,,"isNewsHost,isVerifiedAuthor,isVerifiedSource",,,[],,0,0,,,0,0,,,SEARCH /  / hurricane,0,0,4,0,0,0,0,0,0,0,0,0,0,2091000000,0,9461,0,0,North America,United States,us,Louisiana,New Orleans,-90.0384521484375,29.99542236328125,tw:547082026,,Charisse Gibson,0,DAY,FEMALE,http://pbs.twimg.com/profile_images/1286418373534941184/pxRWw7IT_normal.jpg,OkayCharisse,http://twitter.com/OkayCharisse/,North America,United States,us,Louisiana,New Orleans,-90.0384521484375,29.99542236328125,North America,United States,us,Louisiana,New Orleans,-90.0384521484375,29.99542236328125,15,9461,,MOBILE_OTHER,214681744,11,"Evening News Anchor, Journalist, Storyteller on @WWLTV. Wanna-be screenwriter. IG: Charisse Gibson WWLTV WATCH “The Talk”. Link below.",0,Charisse Gibson,14,
