http://twitter.com/JacobLanierWx/status/1296806553841012737,21/08/20 10:21:37,21/08/20 07:49:10,21/08/20 10:21:50,,New morning spaghetti models continue to slowly shift Tropical Storm #Laura track to the west. 🌀 That could mean time over Cuba which would help disorganize the storm. It also could mean more time over warm Gulf water before a northern Gulf Coast landfall. @WJTV #tropics #MSwx pic.twitter.com/GMRPrT0wkz,,New morning spaghetti models continue to slowly shift Tropical Storm #Laura track to the west. 🌀 That could mean time over Cuba which would help disorganize the storm. It also could mean more time over warm Gulf water before a northern Gulf Coast landfall. @WJTV #tropics #MSwx https://t.co/GMRPrT0wkz,http://twitter.com/JacobLanierWx/,http://twitter.com/,http://twitter.com/,http://twitter.com/JacobLanierWx/status/1296806553841012737,en,0,100,0,0,"SOCIALMEDIA,SOCIALMEDIA_TWITTER",IMAGE,,,"containsImage,hasImage,isNewsHost,isVerifiedAuthor,isVerifiedSource",,,"[{""display_url"":""pic.twitter.com/GMRPrT0wkz"",""expanded_url"":""https://twitter.com/JacobLanierWx/status/1296806553841012737/photo/1"",""url"":""https://t.co/GMRPrT0wkz""}]",http://pbs.twimg.com/media/Ef8urnRXgAEWOol.jpg,0,0,,,0,0,,,SEARCH /  / hurricane,0,0,8,0,0,0,0,0,0,0,0,0,0,2091000000,0,1960,0,0,North America,United States,us,Mississippi,"Jackson, Mississippi",-90.1812744140625,32.29705810546875,tw:3091599753,,Jacob Lanier,0,DAY,MALE,http://pbs.twimg.com/profile_images/1242504266725670917/4B6GIwoR_normal.jpg,JacobLanierWx,http://twitter.com/JacobLanierWx/,North America,United States,us,Mississippi,"Jackson, Mississippi",-90.1812744140625,32.29705810546875,North America,United States,us,Mississippi,"Jackson, Mississippi",-90.1812744140625,32.29705810546875,12,1960,,MOBILE_IOS,214681744,4,Certified Morning Meteorologist at @WJTV 12 (CBM #851) 🌩️ • On air 4:30am-7am • #HailState Alum 🐶 • Atlanta Native • 📨 Email: jlanier@wjtv.com • #MSwx,0,Jacob Lanier,47,
http://twitter.com/PatrickEllisWx/status/1296826756675112960,21/08/20 10:16:48,21/08/20 09:09:27,21/08/20 10:16:54,,A small shift south/west of #Laura's track as the Hurricane Hunters fix on the center was found 80 miles south of previous thought this morning. TD #14 expected to become #Marco; moves toward Texas/Louisiana by early next week. A lot of uncertainty still in the forecast. @WLBT pic.twitter.com/gRbVKMKImN,,A small shift south/west of #Laura's track as the Hurricane Hunters fix on the center was found 80 miles south of previous thought this morning. TD #14 expected to become #Marco; moves toward Texas/Louisiana by early next week. A lot of uncertainty still in the forecast. @WLBT https://t.co/gRbVKMKImN,http://twitter.com/PatrickEllisWx/,http://twitter.com/,http://twitter.com/,http://twitter.com/PatrickEllisWx/status/1296826756675112960,en,0,100,0,0,"SOCIALMEDIA,SOCIALMEDIA_TWITTER",IMAGE,,,"containsImage,hasImage,isNewsHost,isVerifiedAuthor,isVerifiedSource",,,"[{""display_url"":""pic.twitter.com/gRbVKMKImN"",""expanded_url"":""https://twitter.com/PatrickEllisWx/status/1296826756675112960/photo/1"",""url"":""https://t.co/gRbVKMKImN""}]",http://pbs.twimg.com/media/Ef9AkzQXoAIsbqr.jpg,0,0,,,0,0,,,SEARCH /  / hurricane,0,0,3,0,0,0,0,0,0,0,0,0,0,2091000000,0,6330,0,0,North America,United States,us,Mississippi,"Jackson, Mississippi",-90.1812744140625,32.29705810546875,tw:232041154,,Patrick Ellis WLBT,0,DAY,MALE,http://pbs.twimg.com/profile_images/1289358964883423232/Lv5rg5nz_normal.jpg,PatrickEllisWx,http://twitter.com/PatrickEllisWx/,North America,United States,us,Mississippi,"Jackson, Mississippi",-90.1812744140625,32.29705810546875,North America,United States,us,Mississippi,"Jackson, Mississippi",-90.1812744140625,32.29705810546875,6,6330,,PC,214681744,3,"AM Meteorologist @WLBT | @Fox40News. @msstate alum. @saints fan. 🏳️‍🌈. Opinions, views = mine. RT ≠ Endorsement. #mswx #mstraffic #hailstate #geauxsaints",0,Patrick Ellis WLBT,50,
http://twitter.com/criticalcarema1/status/1296946538787344388,21/08/20 17:06:08,21/08/20 17:05:25,21/08/20 17:06:14,,"@JTHVerhovek @BretBaier @DavidMuir @JoeBiden @KamalaHarris @JoeBiden @KamalaHarris remembering hurricane katrina and being shut down, unable to go anywhere or get anything was hard. Never again. Y'all would have made a mistake to shut us down. Glad we have a President that didn't shut the country down. @realDonaldTrump",,"@JTHVerhovek @BretBaier @DavidMuir @JoeBiden @KamalaHarris @JoeBiden @KamalaHarris remembering hurricane katrina and being shut down, unable to go anywhere or get anything was hard. Never again. Y'all would have made a mistake to shut us down. Glad we have a President that didn't shut the country down. @realDonaldTrump",http://twitter.com/criticalcarema1/,http://twitter.com/,http://twitter.com/,http://twitter.com/JTHVerhovek/status/1296939969999667207,en,0,100,0,-5,"SOCIALMEDIA,SOCIALMEDIA_TWITTER",TEXT,,,"isComment,isTwitterReply,isNewsHost",,,[],,0,0,,,0,0,,,SEARCH /  / hurricane,0,0,0,0,0,0,0,0,0,0,0,0,0,2091000000,0,40,0,0,North America,United States,us,Mississippi,Mississippi,-89.6319580078125,32.78594970703125,tw:916054388157935616,,janholmes,0,DAY,UNKNOWN,http://pbs.twimg.com/profile_images/916059057831604224/kxC6Ul8T_normal.jpg,criticalcarema1,http://twitter.com/criticalcarema1/,North America,United States,us,Mississippi,Mississippi,-89.6319580078125,32.78594970703125,North America,United States,us,Mississippi,Mississippi,-89.6319580078125,32.78594970703125,0,40,,MOBILE_ANDROID,214681744,0,Southern Born and Southern Bred.,0,janholmes,47,
http://twitter.com/EpisDioMS/status/1296832689841098752,21/08/20 09:33:24,21/08/20 09:33:01,21/08/20 09:33:25,,Episcopal Relief & Development Supports Response to Hurricane Hanna by the Episcopal Diocese of West Texas #dailyscan #episcopal #goodnews episcopalnewsservice.org/pressreleases/…,,Episcopal Relief & Development Supports Response to Hurricane Hanna by the Episcopal Diocese of West Texas #dailyscan #episcopal #goodnews https://t.co/qdgIfIQ0Ig,http://twitter.com/EpisDioMS/,http://twitter.com/,http://twitter.com/,http://twitter.com/EpisDioMS/status/1296832689841098752,en,0,56,0,5,"SOCIALMEDIA,SOCIALMEDIA_TWITTER",LINK,,,isNewsHost,,,"[{""display_url"":""episcopalnewsservice.org/pressreleases/…"",""expanded_url"":""https://www.episcopalnewsservice.org/pressreleases/episcopal-relief-development-supports-response-to-hurricane-hanna-by-the-episcopal-diocese-of-west-texas/#.Xz_pJWdVlh0.twitter"",""url"":""https://t.co/qdgIfIQ0Ig""}]",,0,0,,,0,0,,,SEARCH /  / hurricane,0,0,0,0,0,0,0,0,0,0,0,0,0,2091000000,0,1517,0,0,North America,United States,us,Mississippi,"Jackson, Mississippi",-90.1812744140625,32.29705810546875,tw:1093032818,,Episcopal Dio of MS,0,DAY,MALE,http://pbs.twimg.com/profile_images/580746433164234752/FVxZhgnQ_normal.png,EpisDioMS,http://twitter.com/EpisDioMS/,North America,United States,us,Mississippi,"Jackson, Mississippi",-90.1812744140625,32.29705810546875,North America,United States,us,Mississippi,"Jackson, Mississippi",-90.1812744140625,32.29705810546875,0,1517,,MOBILE_OTHER,214681744,0,"Episcopal Diocese of Mississippi.....Established 1826.....Mission - “One Church, in Mission: Inviting, Transforming, Reconciling”.....",0,Episcopal Dio of MS,19,
http://twitter.com/thewxgeek/status/1296937888987451397,21/08/20 17:57:02,21/08/20 16:31:03,21/08/20 17:57:22,,6 hours for the GFS to go from nothing to Category 2 hurricane. pic.twitter.com/XIDA3ZH2Ub,,6 hours for the GFS to go from nothing to Category 2 hurricane. https://t.co/XIDA3ZH2Ub,http://twitter.com/thewxgeek/,http://twitter.com/,http://twitter.com/,http://twitter.com/thewxgeek/status/1296937888987451397,en,0,75,0,0,"SOCIALMEDIA,SOCIALMEDIA_TWITTER",VIDEO,,,"containsVideo,hasImage,isNewsHost",,,"[{""display_url"":""pic.twitter.com/XIDA3ZH2Ub"",""expanded_url"":""https://twitter.com/thewxgeek/status/1296937888987451397/photo/1"",""url"":""https://t.co/XIDA3ZH2Ub""}]",http://pbs.twimg.com/tweet_video_thumb/Ef-mCq6WsAEGiZy.jpg,0,0,,https://video.twimg.com/tweet_video/Ef-mCq6WsAEGiZy.mp4,0,0,,,SEARCH /  / hurricane,0,0,2,0,0,0,0,0,0,0,0,0,0,2091000000,0,264,0,0,North America,United States,us,Mississippi,"Hattiesburg, Mississippi",-89.2913818359375,31.32476806640625,tw:889666976972500992,,weathergeek,0,DAY,UNKNOWN,http://pbs.twimg.com/profile_images/1294686308426829831/EyML2h4r_normal.png,thewxgeek,http://twitter.com/thewxgeek/,North America,United States,us,Mississippi,"Hattiesburg, Mississippi",-89.2913818359375,31.32476806640625,North America,United States,us,Mississippi,"Hattiesburg, Mississippi",-89.2913818359375,31.32476806640625,8,264,,MOBILE_OTHER,214681744,6,"Teenage weather enthusiast/mega-geek, tracking storms for 10+ years. #wxtwitter",0,weathergeek,14,
http://twitter.com/BassBron/status/1297039040810831872,21/08/20 23:13:43,21/08/20 23:12:59,21/08/20 23:14:00,,"Judging from my follows I should be in Cali or Washington, instead I’m stuck in a Hurricane sandwich.",,"Judging from my follows I should be in Cali or Washington, instead I’m stuck in a Hurricane sandwich.",http://twitter.com/BassBron/,http://twitter.com/,http://twitter.com/,http://twitter.com/BassBron/status/1297039040810831872,en,0,100,0,-5,"SOCIALMEDIA,SOCIALMEDIA_TWITTER",TEXT,,,isNewsHost,,,[],,0,0,,,0,0,,,SEARCH /  / hurricane,0,0,0,0,0,0,0,0,0,0,0,0,0,2091000000,0,479,0,0,North America,United States,us,Mississippi,"McComb, Mississippi",-90.4669189453125,31.24237060546875,tw:2708875468,,Bron Bass 👽,0,DAY,MALE,http://pbs.twimg.com/profile_images/1193575521365434369/tDdbkpxK_normal.jpg,BassBron,http://twitter.com/BassBron/,North America,United States,us,Mississippi,"McComb, Mississippi",-90.4669189453125,31.24237060546875,North America,United States,us,Mississippi,"McComb, Mississippi",-90.4669189453125,31.24237060546875,1,479,,MOBILE_IOS,214681744,1,I'm an Alien. ♏️ USE PAPER BALLOTS! He/Him,0,Bron Bass 👽,18,
http://twitter.com/_Firejumper/status/1297028719480057861,21/08/20 22:32:26,21/08/20 22:31:59,21/08/20 22:32:34,,My hurricane prediction: R.I.P. Smith County pic.twitter.com/c8lTuhdNwn,,My hurricane prediction: R.I.P. Smith County https://t.co/c8lTuhdNwn,http://twitter.com/_Firejumper/,http://twitter.com/,http://twitter.com/,http://twitter.com/_Firejumper/status/1297028719480057861,en,0,17,0,0,"SOCIALMEDIA,SOCIALMEDIA_TWITTER",IMAGE,,,"containsImage,hasImage,isNewsHost",,,"[{""display_url"":""pic.twitter.com/c8lTuhdNwn"",""expanded_url"":""https://twitter.com/_Firejumper/status/1297028719480057861/photo/1"",""url"":""https://t.co/c8lTuhdNwn""}]",http://pbs.twimg.com/media/Ef_4tNEXsAMmizb.jpg,0,0,,,0,0,,,SEARCH /  / hurricane,0,0,0,0,0,0,0,0,0,0,0,0,0,2091000000,0,623,0,0,North America,United States,us,Mississippi,Mississippi,-89.6319580078125,32.78594970703125,tw:1005949329629155328,,Chris Hughes,0,DAY,MALE,http://pbs.twimg.com/profile_images/1271094349896593416/0MvRwIY3_normal.jpg,_Firejumper,http://twitter.com/_Firejumper/,North America,United States,us,Mississippi,Mississippi,-89.6319580078125,32.78594970703125,North America,United States,us,Mississippi,Mississippi,-89.6319580078125,32.78594970703125,7,623,,MOBILE_IOS,214681744,7,Parler @Firejumper | Instagram chris_hughes66 |  #HailState,0,Chris Hughes,7,
http://twitter.com/MSEMA/status/1296918332717883396,21/08/20 15:14:07,21/08/20 15:13:20,21/08/20 15:14:12,,"#TD14 is forecasted to make landfall in Texas or Louisiana Tuesday afternoon as a tropical storm. Additionally, #TropicalStormLaura is expected to strengthen to a hurricane making landfall anywhere from Louisiana to Florida on Wednesday. Follow @NHC_Atlantic for more updates! pic.twitter.com/5JV5JlobgO",,"#TD14 is forecasted to make landfall in Texas or Louisiana Tuesday afternoon as a tropical storm. Additionally, #TropicalStormLaura is expected to strengthen to a hurricane making landfall anywhere from Louisiana to Florida on Wednesday. Follow @NHC_Atlantic for more updates! https://t.co/5JV5JlobgO",http://twitter.com/MSEMA/,http://twitter.com/,http://twitter.com/,http://twitter.com/MSEMA/status/1296918332717883396,en,0,100,0,0,"SOCIALMEDIA,SOCIALMEDIA_TWITTER",IMAGE,,,"containsImage,hasImage,isNewsHost,isVerifiedAuthor,isVerifiedSource",,,"[{""display_url"":""pic.twitter.com/5JV5JlobgO"",""expanded_url"":""https://twitter.com/MSEMA/status/1296918332717883396/photo/1"",""url"":""https://t.co/5JV5JlobgO""}]",http://pbs.twimg.com/media/Ef-UWTkXsAASipM.jpg,0,0,,,0,0,,,SEARCH /  / hurricane,0,0,1,0,0,0,0,0,0,0,0,0,0,2091000000,0,22331,0,0,North America,United States,us,Mississippi,"Pearl, Mississippi",-90.1043701171875,32.26959228515625,tw:17395987,,msema,0,DAY,UNKNOWN,http://pbs.twimg.com/profile_images/1232049854463037440/fk2jhFnb_normal.jpg,MSEMA,http://twitter.com/MSEMA/,North America,United States,us,Mississippi,"Pearl, Mississippi",-90.1043701171875,32.26959228515625,North America,United States,us,Mississippi,"Pearl, Mississippi",-90.1043701171875,32.26959228515625,1,22331,,MOBILE_IOS,214681744,0,This Twitter account is not monitored 24-hours a day.  In case of an emergency please dial 9-1-1.,0,msema,40,
http://twitter.com/JacobLanierWx/status/1296755881644785664,21/08/20 04:28:12,21/08/20 04:27:49,21/08/20 04:28:13,,"GULF WATCH 🌀: Southeast Mississippi is now included in the forecast cone for a Wednesday AM hurricane landfall. However, the cone still ranges from Tampa to New Orleans, so it’s a *very large range of uncertainty.* Track will be narrowed down this weekend. @WJTV #MSwx #tropics pic.twitter.com/hAU07CeoAw",,"GULF WATCH 🌀: Southeast Mississippi is now included in the forecast cone for a Wednesday AM hurricane landfall. However, the cone still ranges from Tampa to New Orleans, so it’s a *very large range of uncertainty.* Track will be narrowed down this weekend. @WJTV #MSwx #tropics https://t.co/hAU07CeoAw",http://twitter.com/JacobLanierWx/,http://twitter.com/,http://twitter.com/,http://twitter.com/JacobLanierWx/status/1296755881644785664,en,0,84,0,0,"SOCIALMEDIA,SOCIALMEDIA_TWITTER",IMAGE,,,"containsImage,hasImage,isNewsHost,isVerifiedAuthor,isVerifiedSource",,,"[{""display_url"":""pic.twitter.com/hAU07CeoAw"",""expanded_url"":""https://twitter.com/JacobLanierWx/status/1296755881644785664/photo/1"",""url"":""https://t.co/hAU07CeoAw""}]",http://pbs.twimg.com/media/Ef8AmMyWsAAOvXQ.jpg,0,0,,,0,0,,,SEARCH /  / hurricane,0,0,7,0,0,0,0,0,0,0,0,0,0,2091000000,0,1959,0,0,North America,United States,us,Mississippi,"Jackson, Mississippi",-90.1812744140625,32.29705810546875,tw:3091599753,,Jacob Lanier,0,DAY,MALE,http://pbs.twimg.com/profile_images/1242504266725670917/4B6GIwoR_normal.jpg,JacobLanierWx,http://twitter.com/JacobLanierWx/,North America,United States,us,Mississippi,"Jackson, Mississippi",-90.1812744140625,32.29705810546875,North America,United States,us,Mississippi,"Jackson, Mississippi",-90.1812744140625,32.29705810546875,11,1959,,MOBILE_IOS,214681744,4,Certified Morning Meteorologist at @WJTV 12 (CBM #851) 🌩️ • On air 4:30am-7am • #HailState Alum 🐶 • Atlanta Native • 📨 Email: jlanier@wjtv.com • #MSwx,0,Jacob Lanier,46,
http://twitter.com/MadsonMike/status/1296786195146575872,21/08/20 06:28:59,21/08/20 06:28:16,21/08/20 06:29:08,,Well looks like it’s time to start hurricane prep. Maybe we will thread the needle between the two.,,Well looks like it’s time to start hurricane prep. Maybe we will thread the needle between the two.,http://twitter.com/MadsonMike/,http://twitter.com/,http://twitter.com/,http://twitter.com/MadsonMike/status/1296786195146575872,en,0,100,0,0,"SOCIALMEDIA,SOCIALMEDIA_TWITTER",TEXT,,,isNewsHost,,,[],,0,0,,,0,0,,,SEARCH /  / hurricane,0,0,0,0,0,0,0,0,0,0,0,0,0,2091000000,0,114,0,0,North America,United States,us,Mississippi,"Hattiesburg, Mississippi",-89.2913818359375,31.32476806640625,tw:2916506680,,Mike Madson,0,DAY,MALE,http://pbs.twimg.com/profile_images/1227395387125833728/IawmxRou_normal.jpg,MadsonMike,http://twitter.com/MadsonMike/,North America,United States,us,Mississippi,"Hattiesburg, Mississippi",-89.2913818359375,31.32476806640625,North America,United States,us,Mississippi,"Hattiesburg, Mississippi",-89.2913818359375,31.32476806640625,2,114,,MOBILE_IOS,214681744,2,Professor of psychology; dog dad to Nola and a Lambeaux; BBQ Pitmaster and Green Bay Packer fan.,0,Mike Madson,18,
http://twitter.com/jamie_arrington/status/1296912488366313474,21/08/20 21:20:58,21/08/20 14:50:07,21/08/20 21:21:14,,Somewhere there is a dad patiently waiting for Tropical Depression Fourteen to be upgraded to Tropical Storm Marco just so he can tweet “POLO!” #TD14,,Somewhere there is a dad patiently waiting for Tropical Depression Fourteen to be upgraded to Tropical Storm Marco just so he can tweet “POLO!” #TD14,http://twitter.com/jamie_arrington/,http://twitter.com/,http://twitter.com/,http://twitter.com/jamie_arrington/status/1296912488366313474,en,0,100,0,0,"SOCIALMEDIA,SOCIALMEDIA_TWITTER",TEXT,,,isNewsHost,,,[],,0,0,,,0,0,,,SEARCH /  / hurricane,0,0,1,0,0,0,0,0,0,0,0,0,0,2091000000,0,1913,0,0,North America,United States,us,Mississippi,"West Hattiesburg, Mississippi",-89.3353271484375,31.30828857421875,tw:27783978,,Jamie Arrington,0,DAY,MALE,http://pbs.twimg.com/profile_images/1276195562560389123/dXsxoCPk_normal.jpg,jamie_arrington,http://twitter.com/jamie_arrington/,North America,United States,us,Mississippi,"Hattiesburg, Mississippi",-89.2913818359375,31.32476806640625,North America,United States,us,Mississippi,"Hattiesburg, Mississippi",-89.2913818359375,31.32476806640625,14,1913,,MOBILE_IOS,214681744,13,Comedian. Host of @ToTheTopTalk. Founder of @hubcitycomedy. Former NCAA/NFL/NHL mascot. #SMTTT #WontBowDown #Saints #Bears100 #Yotes #HOWLYEAH,0,Jamie Arrington,25,
http://twitter.com/MSEMA/status/1296861307124277249,21/08/20 11:51:47,21/08/20 11:26:44,21/08/20 11:51:52,,"Hurricane shelter operations have evolved due to #COVID19 and we want you to be aware of these changes especially with two tropical systems currently threatening the Gulf. For a list frequently asked sheltering questions, click here: msema.org/wp-content/upl… pic.twitter.com/4Zv2Dyi2lp",,"Hurricane shelter operations have evolved due to #COVID19 and we want you to be aware of these changes especially with two tropical systems currently threatening the Gulf. For a list frequently asked sheltering questions, click here: https://t.co/jKvsqkAl3c https://t.co/4Zv2Dyi2lp",http://twitter.com/MSEMA/,http://twitter.com/,http://twitter.com/,http://twitter.com/MSEMA/status/1296861307124277249,en,0,100,0,0,"SOCIALMEDIA,SOCIALMEDIA_TWITTER",IMAGE,,,"containsImage,hasImage,isNewsHost,isVerifiedAuthor,isVerifiedSource",,,"[{""display_url"":""pic.twitter.com/4Zv2Dyi2lp"",""expanded_url"":""https://twitter.com/MSEMA/status/1296861307124277249/photo/1"",""url"":""https://t.co/4Zv2Dyi2lp""},{""display_url"":""msema.org/wp-content/upl…"",""expanded_url"":""https://www.msema.org/wp-content/uploads/2020/08/Shelter-Operations-in-a-COVID19-Environment-FAQ-Final.pdf"",""url"":""https://t.co/jKvsqkAl3c""}]",http://pbs.twimg.com/media/Ef9gO0KWsAEeY46.jpg,0,0,,,0,0,,,SEARCH /  / hurricane,0,0,6,0,0,0,0,0,0,0,0,0,0,2091000000,0,22328,0,0,North America,United States,us,Mississippi,"Pearl, Mississippi",-90.1043701171875,32.26959228515625,tw:17395987,,msema,0,DAY,UNKNOWN,http://pbs.twimg.com/profile_images/1232049854463037440/fk2jhFnb_normal.jpg,MSEMA,http://twitter.com/MSEMA/,North America,United States,us,Mississippi,"Pearl, Mississippi",-90.1043701171875,32.26959228515625,North America,United States,us,Mississippi,"Pearl, Mississippi",-90.1043701171875,32.26959228515625,8,22328,,MOBILE_OTHER,214681744,2,This Twitter account is not monitored 24-hours a day.  In case of an emergency please dial 9-1-1.,0,msema,38,
http://twitter.com/WesWilliamsII/status/1296805195532378112,21/08/20 07:55:15,21/08/20 07:43:46,21/08/20 07:55:22,,"🌀Look at #Laura, 2020's latest tropical storm. Hurricane Hunters found max sustained winds of 45 mph. They also found Laura's center was farther south than expected. This could change the storm's forecast track. New track will come out at 10 AM. #TSLaura pic.twitter.com/Xng7r5eO3O",,"🌀Look at #Laura, 2020's latest tropical storm. Hurricane Hunters found max sustained winds of 45 mph. They also found Laura's center was farther south than expected. This could change the storm's forecast track. New track will come out at 10 AM. #TSLaura https://t.co/Xng7r5eO3O",http://twitter.com/WesWilliamsII/,http://twitter.com/,http://twitter.com/,http://twitter.com/WesWilliamsII/status/1296805195532378112,en,0,100,0,0,"SOCIALMEDIA,SOCIALMEDIA_TWITTER",VIDEO,,,"containsVideo,hasImage,isNewsHost,isVerifiedAuthor,isVerifiedSource",,,"[{""display_url"":""pic.twitter.com/Xng7r5eO3O"",""expanded_url"":""https://twitter.com/WesWilliamsII/status/1296805195532378112/video/1"",""url"":""https://t.co/Xng7r5eO3O""}]",http://pbs.twimg.com/amplify_video_thumb/1296805158471569413/img/Ds9ZvuGHetEODnHF.jpg,0,0,,https://video.twimg.com/amplify_video/1296805158471569413/vid/480x270/6XQ2-_SDbZPQpHlD.mp4?tag=13,0,0,,,SEARCH /  / hurricane,0,0,2,0,0,0,0,0,0,0,0,0,0,2091000000,0,3600,0,0,North America,United States,us,Mississippi,"Biloxi, Mississippi",-88.8848876953125,30.39642333984375,tw:529411773,,Wesley Williams,0,DAY,MALE,http://pbs.twimg.com/profile_images/580515781613608960/GsxieJM9_normal.jpg,WesWilliamsII,http://twitter.com/WesWilliamsII/,North America,United States,us,Mississippi,"Biloxi, Mississippi",-88.8848876953125,30.39642333984375,North America,United States,us,Mississippi,"Biloxi, Mississippi",-88.8848876953125,30.39642333984375,9,3600,,EXTERNAL_WEBSITE,214681744,7,Meteorologist for @WLOX. I say things about the weather. I share weather things that interest me. Thaaaaaats about it. http://fb.com/weatherwes,0,Wesley Williams,44,
http://twitter.com/VAlonsoWCBI/status/1296801374760468480,21/08/20 07:29:07,21/08/20 07:28:35,21/08/20 07:29:17,,BREAKING: #TD13 is now Tropical Storm #Laura. #WCBI #Tropics pic.twitter.com/79mnsPtgEo,,BREAKING: #TD13 is now Tropical Storm #Laura. #WCBI #Tropics https://t.co/79mnsPtgEo,http://twitter.com/VAlonsoWCBI/,http://twitter.com/,http://twitter.com/,http://twitter.com/VAlonsoWCBI/status/1296801374760468480,en,0,0,0,0,"SOCIALMEDIA,SOCIALMEDIA_TWITTER",IMAGE,,,"containsImage,hasImage,isNewsHost",,,"[{""display_url"":""pic.twitter.com/79mnsPtgEo"",""expanded_url"":""https://twitter.com/VAlonsoWCBI/status/1296801374760468480/photo/1"",""url"":""https://t.co/79mnsPtgEo""}]",http://pbs.twimg.com/media/Ef8pxYIXoAEtcf9.jpg,0,0,,,0,0,,,SEARCH /  / hurricane,0,0,0,0,0,0,0,0,0,0,0,0,0,2091000000,0,2392,0,0,North America,United States,us,Mississippi,"Columbus, Mississippi",-88.4124755859375,33.50006103515625,tw:296321384,,Meteorologist Vanessa Alonso WCBI,0,DAY,FEMALE,http://pbs.twimg.com/profile_images/1142677858596335617/bZdFEqEf_normal.jpg,VAlonsoWCBI,http://twitter.com/VAlonsoWCBI/,North America,United States,us,Mississippi,"Columbus, Mississippi",-88.4124755859375,33.50006103515625,North America,United States,us,Mississippi,"Columbus, Mississippi",-88.4124755859375,33.50006103515625,0,2392,,PC,214681744,0,"@WCBIWeather Sunrise/Midday Meteorologist. #mswx #alwx Hometown Miami, FL. @UnivMiami Graduate. @AMetSoc CBM Seal #815. #SamanthaOliviaTheWeatherSeal #WomenOfWx",0,Meteorologist Vanessa Alonso WCBI,10,
http://twitter.com/tdpilot/status/1296848051915632642,21/08/20 10:35:13,21/08/20 10:34:04,21/08/20 10:35:22,,New Hurricane Season ramping up! And still very few areas have Storm Surge Barriers. 1drv.ms/w/s!Aly-RATCX_…,,New Hurricane Season ramping up! And still very few areas have Storm Surge Barriers. https://t.co/xiZ62nHKqh,http://twitter.com/tdpilot/,http://twitter.com/,http://twitter.com/,http://twitter.com/tdpilot/status/1296848051915632642,en,0,79,0,0,"SOCIALMEDIA,SOCIALMEDIA_TWITTER",LINK,,,isNewsHost,,,"[{""display_url"":""1drv.ms/w/s!Aly-RATCX_…"",""expanded_url"":""https://1drv.ms/w/s!Aly-RATCX_81gZ0SIW86rOEAsY6oTg?e=8sKigh"",""url"":""https://t.co/xiZ62nHKqh""}]",,0,0,,,0,0,,,SEARCH /  / hurricane,0,0,0,0,0,0,0,0,0,0,0,0,0,2091000000,0,7,0,0,North America,United States,us,Mississippi,"Diamondhead, Mississippi",-89.3682861328125,30.38543701171875,tw:18077178,,Lee Taylor,0,DAY,MALE,http://pbs.twimg.com/profile_images/71918727/me__dogs__planes_full1_normal.jpg,tdpilot,http://twitter.com/tdpilot/,North America,United States,us,Mississippi,"Diamondhead, Mississippi",-89.3682861328125,30.38543701171875,North America,United States,us,Mississippi,"Diamondhead, Mississippi",-89.3682861328125,30.38543701171875,0,7,,MOBILE_OTHER,214681744,0,"CFII, pilot, sailor, real estate developer",0,Lee Taylor,15,
